{
  "schema_version": "1.0",
  "id": "low_back",
  "title": "Lage rug, bekken en gerefereerde klachten: differentiaal en anamneseleidraad",
  "version": "0.1.0",
  "language": "nl-NL",
  "created_on": "2026-10-07",
  "status": "draft_requires_clinical_review",
  "activation": {
    "clinically_reviewed": false,
    "automatic_advice_enabled": false,
    "reviewer": null,
    "review_date": null
  },
  "scope": {
    "population": "Volwassenen in fysiotherapeutische eerstelijnscontext; geen zelfstandige diagnose- of triageapplicatie.",
    "coverage": "Brede eerste conceptmodule; niet uitputtend.",
    "exclusions": [
      "Kinderen en adolescenten vereisen aanvullende pediatrische veiligheidsmodule",
      "Postoperatieve revalidatie, implantaatcomplicaties en specifieke oncologische behandelprotocollen",
      "Alle buik-, gynaecologische, urologische en heuppathologieën als afzonderlijke volledige modules",
      "Prescriptieve medicatie-, operatie- of beeldvormingsbeslissingen"
    ],
    "known_gaps": [
      "Actuele volledige NHG-standaarden niet toegankelijk tijdens controle; Nederlandse medische verwijspaden nog door inhoudsdeskundige harmoniseren",
      "Sommige zeldzame spoedpaden zijn alleen door algemene richtlijnen ondersteund; afzonderlijke actuele bronnen toevoegen",
      "Isthmische spondylolisthesis en oudere stenose/parsbronnen nader actualiseren",
      "Geen gevalideerde waarschijnlijkheidsberekening, testcombinatie-algoritme of volledigheidsscore",
      "Geen automatische negatieve conclusie uit afwezige transcriptinformatie"
    ]
  },
  "ai_rules": [
    "Gebruik dit bestand om conditioneel vragen voor te stellen, niet om zelfstandig diagnoses te stellen",
    "Niet besproken betekent onbekend, nooit ontkend",
    "Een vraag van de therapeut is geen patiëntantwoord; voorbeeld, hypothese en familiegeschiedenis niet als actuele patiëntbevinding extraheren",
    "Bewaar letterlijk transcriptbewijs, spreker, subject, datum/tijd en nieuw versus bestaand; bij negatie- of transcriptietwijfel eerst verifiëren",
    "Veiligheidssignalen gaan voor volledigheid: geen onderzoek of lange checklist laten wachten op plausibele spoed",
    "Geen aantal vinkjes, symptoomtelling of bronloze kanspercentages gebruiken als diagnose",
    "Onderzoeksbevindingen alleen opslaan als daadwerkelijk uitgevoerd en expliciet beschreven; nooit uit spraak afleiden dat kracht/reflexen normaal zijn",
    "Verworpen hypotheses met reden en datum bewaren; bij verandering heropenen",
    "Risicofactor, prognostische factor, teken en behandelbare factor zijn verschillende rollen",
    "Geen algemene psychosociale verklaring gebruiken om medische pathologie uit te sluiten",
    "Een expliciete ontkenning of normaal onderzoek kan een specifieke aandoening niet altijd uitsluiten",
    "Advies toont reden, relevante ontbrekende informatie, urgentie, onzekerheid en bron; fysiotherapeut beslist",
    "Onbekende regio, uitgesloten populatie of dekkingsgat expliciet aangeven en menselijke beoordeling vragen"
  ],
  "evidence_contract": {
    "states": [
      "not_discussed",
      "present",
      "denied",
      "unclear",
      "not_applicable"
    ],
    "required_fields": [
      "topic_id",
      "state",
      "speaker",
      "subject",
      "evidence_quote",
      "observed_at",
      "time_context",
      "verification"
    ],
    "time_context_values": [
      "new",
      "worsening",
      "stable_existing",
      "historical",
      "unknown"
    ],
    "verification_values": [
      "transcript_only",
      "clinician_confirmed",
      "uncertain_transcription"
    ],
    "rules": [
      "not_applicable vereist expliciete klinische motivering",
      "not_discussed heeft geen evidence_quote; andere states vereisen bewijs of expliciete cliniciannotitie",
      "Bewaar tegenstrijdige uitspraken en markeer unclear; overschrijf niet stilzwijgend",
      "Geen gevoelige onderwerpen afdwingen zonder respectvolle klinische afweging",
      "Geen patiëntgegevens in de kennisbestanden of GitHub opslaan"
    ]
  },
  "shared_profiles": [
    {
      "id": "general_lbp",
      "title": "Algemene prognostische en behandelbare context voor LBP/LRS",
      "applies_to": "Aspecifieke LBP/LRS waar klinisch passend; niet als universeel prognosemodel bij infectie, kanker, fractuur of viscerale ziekte.",
      "prognostic_factors": [
        "Eerdere episoden, hoge pijn-/beperkingslast en beenpijn",
        "Algemene gezondheid en kwaliteit van leven",
        "Stress, bewegingsangst, depressieve symptomen, passieve coping en negatieve herstelverwachtingen",
        "Fysiek zwaar werk, werkomgeving en tevredenheid"
      ],
      "therapeutically_modifiable_factors": [
        "Bewegen en functionele belastbaarheid via passende oefenopbouw",
        "Voorlichting, verwachtingen, zelfmanagement en gedrag met patiënt afstemmen",
        "Werk-/activiteitsaanpassingen en steun waar beïnvloedbaar",
        "Psychologische ondersteuning indien passend en met instemming"
      ],
      "limitations": [
        "Prognostische associaties zijn geen bewijs van individuele oorzaak",
        "Niet elke factor is door fysiotherapie te veranderen",
        "Geen vragenlijst als zelfstandige beslissing of exacte herstelvoorspelling"
      ],
      "source_ids": [
        "KNGF",
        "NG59"
      ]
    }
  ],
  "mechanism_context": [
    {
      "id": "nociplastic_context",
      "title": "Mogelijke nociplastische bijdrage, los van een weefsel-DD",
      "clues": [
        "Persisterende regionale/multifocale pijn met klinisch te beoordelen overgevoeligheid",
        "Niet volledig door nociceptieve of neuropathische mechanismen verklaard"
      ],
      "assessment": [
        "Gezamenlijk mechanismeonderzoek door clinicus; transcript alleen onvoldoende",
        "Overweeg slaap, vermoeidheid en belastingervaring als context zonder daarmee somatische oorzaken te verwerpen"
      ],
      "limitations": [
        "Psychologische stress of hoge CSI-score stelt geen nociplastische diagnose",
        "Kan samen voorkomen met nociceptieve of neuropathische processen"
      ],
      "source_ids": [
        "NOCIPLASTIC"
      ]
    }
  ],
  "questions": [
    {
      "id": "onset",
      "text": "Wanneer begon de pijn, wat gebeurde er toen en hoe is het sindsdien veranderd?",
      "ask_when": "basisonderzoek",
      "purpose": "klinische context",
      "priority": "routine",
      "source_ids": [],
      "origin": "eigen operationalisering; geen gevalideerde vragenlijst",
      "follow_up": "Bij een relevant antwoord: sinds wanneer, nieuw/veranderd, een- of tweezijdig, ernst, verloop en eerdere beoordeling vastleggen."
    },
    {
      "id": "distribution",
      "text": "Waar voelt u de pijn precies en trekt deze door naar bil, lies, been, buik of flank?",
      "ask_when": "basisonderzoek",
      "purpose": "klinische context",
      "priority": "routine",
      "source_ids": [],
      "origin": "eigen operationalisering; geen gevalideerde vragenlijst",
      "follow_up": "Bij een relevant antwoord: sinds wanneer, nieuw/veranderd, een- of tweezijdig, ernst, verloop en eerdere beoordeling vastleggen."
    },
    {
      "id": "function",
      "text": "Welke activiteiten, werk, sport, zelfzorg en slaap lukken minder goed; wat wilt u weer kunnen?",
      "ask_when": "basisonderzoek",
      "purpose": "klinische context",
      "priority": "routine",
      "source_ids": [],
      "origin": "eigen operationalisering; geen gevalideerde vragenlijst",
      "follow_up": "Bij een relevant antwoord: sinds wanneer, nieuw/veranderd, een- of tweezijdig, ernst, verloop en eerdere beoordeling vastleggen."
    },
    {
      "id": "load",
      "text": "Welke bewegingen, houdingen en belastingen veranderen de klachten, en wat gebeurt er daarna?",
      "ask_when": "basisonderzoek",
      "purpose": "klinische context",
      "priority": "routine",
      "source_ids": [],
      "origin": "eigen operationalisering; geen gevalideerde vragenlijst",
      "follow_up": "Bij een relevant antwoord: sinds wanneer, nieuw/veranderd, een- of tweezijdig, ernst, verloop en eerdere beoordeling vastleggen."
    },
    {
      "id": "history",
      "text": "Heeft u dit eerder gehad, welke diagnoses of onderzoeken zijn gedaan en wat hielp toen?",
      "ask_when": "basisonderzoek",
      "purpose": "klinische context",
      "priority": "routine",
      "source_ids": [],
      "origin": "eigen operationalisering; geen gevalideerde vragenlijst",
      "follow_up": "Bij een relevant antwoord: sinds wanneer, nieuw/veranderd, een- of tweezijdig, ernst, verloop en eerdere beoordeling vastleggen."
    },
    {
      "id": "medical",
      "text": "Welke ziekten, operaties, medicijnen en recente wijzigingen zijn relevant? Denk ook aan corticosteroïden en bloedverdunners.",
      "ask_when": "basisonderzoek",
      "purpose": "klinische context",
      "priority": "routine",
      "source_ids": [],
      "origin": "eigen operationalisering; geen gevalideerde vragenlijst",
      "follow_up": "Bij een relevant antwoord: sinds wanneer, nieuw/veranderd, een- of tweezijdig, ernst, verloop en eerdere beoordeling vastleggen."
    },
    {
      "id": "course",
      "text": "Zijn de klachten stabiel, herstellend of toenemend, en wat is sinds de vorige beoordeling veranderd?",
      "ask_when": "basisonderzoek",
      "purpose": "klinische context",
      "priority": "routine",
      "source_ids": [],
      "origin": "eigen operationalisering; geen gevalideerde vragenlijst",
      "follow_up": "Bij een relevant antwoord: sinds wanneer, nieuw/veranderd, een- of tweezijdig, ernst, verloop en eerdere beoordeling vastleggen."
    },
    {
      "id": "trauma",
      "text": "Was er een val, ongeval, botsing of andere plotselinge belasting; hoe groot was die?",
      "ask_when": "basisonderzoek",
      "purpose": "mogelijke fractuur/trauma",
      "priority": "routine",